{
  "artifact_type": "TASK_COMPLETION_POINTER",
  "status": "MERGE_OBSERVED",
  "owner": "WEB_BRAIN",
  "project_id": "JOYFLOW_DEVELOPMENT",
  "task_id": "TASK_PHASE1E_AI_NATIVE_CHANGE_PROJECTION_REPAIR",
  "round_id": 1,
  "task_capsule_id": "CAPSULE_PHASE1E_AI_NATIVE_CHANGE_PROJECTION_REPAIR",
  "repository_id": "example/repo",
  "pr_url": "https://github.com/example/repo/pull/42",
  "reviewed_head_sha": "f8a5f006b48461efacd6573638d0ee74af1bcd53",
  "merge_candidate_freeze_digest": "6c1ca6b831827c19648c891b3341352e29cd91188935ad9d3418d6cb14780070",
  "user_acceptance_capsule_digest": "2abeadc0e39ab4db86987f037e0eadc46eb573ae7fadb8a7d0a28348a8560479",
  "user_merge_authorization_digest": "10335711c0001b1db5f121d2f478b1fcdce0310e763f10ec959496219b213bd2",
  "merge_commit": "dddddddddddddddddddddddddddddddddddddddd",
  "repository_evidence_ref": "https://api.github.com/repos/example/repo/pulls/42",
  "repository_evidence_sha256": "4e1c130ceb678309bebdbd72368bfeb01807a5b94bb5a1c412fb714d013c5e51",
  "result": "MERGED_REPOSITORY_RESULT",
  "pointer_digest": "6b2aa09f08494e8238320577d069e9d673fcc7c3912ce445f19b5dbb610c5993"
}
